{
  "$schema": "https://json-schema.org/draft/2020-12/schema",
  "additionalProperties": false,
  "properties": {
    "airport": {
      "type": "string"
    },
    "expected": {
      "anyOf": [
        {
          "additionalProperties": false,
          "properties": {
            "altitude": {
              "additionalProperties": false,
              "properties": {
                "feet": {
                  "exclusiveMinimum": 0,
                  "maximum": 9007199254740991,
                  "type": "integer"
                },
                "phrase": {
                  "enum": [
                    "climb_via",
                    "climb_via_except",
                    "maintain"
                  ],
                  "type": "string"
                }
              },
              "required": [
                "phrase"
              ],
              "type": "object"
            },
            "clearedTo": {
              "type": "string"
            },
            "expect": {
              "anyOf": [
                {
                  "anyOf": [
                    {
                      "additionalProperties": false,
                      "properties": {
                        "amended": {
                          "type": "boolean"
                        },
                        "feet": {
                          "exclusiveMinimum": 0,
                          "maximum": 9007199254740991,
                          "type": "integer"
                        },
                        "minutes": {
                          "exclusiveMinimum": 0,
                          "maximum": 9007199254740991,
                          "type": "integer"
                        }
                      },
                      "required": [
                        "feet",
                        "minutes"
                      ],
                      "type": "object"
                    },
                    {
                      "additionalProperties": false,
                      "properties": {
                        "feet": {
                          "exclusiveMinimum": 0,
                          "maximum": 9007199254740991,
                          "type": "integer"
                        },
                        "final": {
                          "const": true,
                          "type": "boolean"
                        }
                      },
                      "required": [
                        "feet",
                        "final"
                      ],
                      "type": "object"
                    }
                  ]
                },
                {
                  "type": "null"
                }
              ]
            },
            "frequency": {
              "type": "string"
            },
            "heading": {
              "anyOf": [
                {
                  "const": "runway heading",
                  "type": "string"
                },
                {
                  "maximum": 360,
                  "minimum": 1,
                  "type": "integer"
                }
              ]
            },
            "route": {
              "additionalProperties": false,
              "properties": {
                "fix": {
                  "type": "string"
                },
                "template": {
                  "enum": [
                    "transition",
                    "radar_vectors_fix",
                    "radar_vectors_airway",
                    "radar_vectors_direct",
                    "as_filed"
                  ],
                  "type": "string"
                }
              },
              "required": [
                "template"
              ],
              "type": "object"
            },
            "sidFamily": {
              "type": [
                "string",
                "null"
              ]
            },
            "spoken": {
              "type": "string"
            }
          },
          "required": [
            "clearedTo",
            "sidFamily",
            "route",
            "altitude",
            "expect",
            "frequency"
          ],
          "type": "object"
        },
        {
          "additionalProperties": false,
          "properties": {
            "amendments": {
              "items": {
                "oneOf": [
                  {
                    "additionalProperties": false,
                    "properties": {
                      "alternativeTo": {
                        "enum": [
                          "type",
                          "altitude",
                          "route"
                        ],
                        "type": "string"
                      },
                      "arrivalSwap": {
                        "type": "string"
                      },
                      "box": {
                        "const": "route",
                        "type": "string"
                      },
                      "proposed": {
                        "type": "string"
                      },
                      "reason": {
                        "type": "string"
                      },
                      "warning": {
                        "type": "boolean"
                      }
                    },
                    "required": [
                      "box",
                      "proposed",
                      "reason"
                    ],
                    "type": "object"
                  },
                  {
                    "additionalProperties": false,
                    "properties": {
                      "alternativeTo": {
                        "enum": [
                          "type",
                          "altitude",
                          "route"
                        ],
                        "type": "string"
                      },
                      "box": {
                        "const": "altitude",
                        "type": "string"
                      },
                      "proposedFeet": {
                        "exclusiveMinimum": 0,
                        "maximum": 9007199254740991,
                        "type": "integer"
                      },
                      "reason": {
                        "type": "string"
                      }
                    },
                    "required": [
                      "box",
                      "proposedFeet",
                      "reason"
                    ],
                    "type": "object"
                  },
                  {
                    "additionalProperties": false,
                    "properties": {
                      "alternativeTo": {
                        "enum": [
                          "type",
                          "altitude",
                          "route"
                        ],
                        "type": "string"
                      },
                      "box": {
                        "const": "type",
                        "type": "string"
                      },
                      "proposed": {
                        "type": "string"
                      },
                      "reason": {
                        "type": "string"
                      }
                    },
                    "required": [
                      "box",
                      "proposed",
                      "reason"
                    ],
                    "type": "object"
                  }
                ]
              },
              "type": "array"
            }
          },
          "required": [
            "amendments"
          ],
          "type": "object"
        }
      ]
    },
    "id": {
      "type": "string"
    },
    "mode": {
      "enum": [
        "clearance",
        "amendment"
      ],
      "type": "string"
    },
    "scenario": {
      "additionalProperties": false,
      "properties": {
        "activeNotices": {
          "items": {
            "type": "string"
          },
          "type": "array"
        },
        "aircraftType": {
          "type": "string"
        },
        "callsign": {
          "type": "string"
        },
        "dayOfWeek": {
          "enum": [
            "sunday",
            "monday",
            "tuesday",
            "wednesday",
            "thursday",
            "friday",
            "saturday"
          ],
          "type": "string"
        },
        "departureRunway": {
          "type": "string"
        },
        "destination": {
          "type": "string"
        },
        "equipmentSuffix": {
          "anyOf": [
            {
              "pattern": "^\\/[A-Z]$",
              "type": "string"
            },
            {
              "type": "null"
            }
          ]
        },
        "filedAltitude": {
          "exclusiveMinimum": 0,
          "maximum": 9007199254740991,
          "type": "integer"
        },
        "filedRoute": {
          "type": "string"
        },
        "localTime": {
          "pattern": "^([01]\\d|2[0-3])[0-5]\\d$",
          "type": "string"
        },
        "remarks": {
          "type": "string"
        },
        "runwayConfigId": {
          "type": "string"
        },
        "squawk": {
          "pattern": "^[0-7]{4}$",
          "type": "string"
        }
      },
      "required": [
        "callsign",
        "aircraftType",
        "equipmentSuffix",
        "destination",
        "filedRoute",
        "filedAltitude",
        "runwayConfigId",
        "departureRunway",
        "localTime",
        "dayOfWeek",
        "squawk"
      ],
      "type": "object"
    },
    "sidVersions": {
      "additionalProperties": {
        "additionalProperties": false,
        "properties": {
          "id": {
            "type": "string"
          },
          "spoken": {
            "type": "string"
          }
        },
        "required": [
          "id",
          "spoken"
        ],
        "type": "object"
      },
      "propertyNames": {
        "type": "string"
      },
      "type": "object"
    },
    "source": {
      "additionalProperties": false,
      "properties": {
        "date": {
          "type": "string"
        },
        "kind": {
          "enum": [
            "worksheet",
            "synthetic"
          ],
          "type": "string"
        },
        "note": {
          "type": "string"
        },
        "trainer": {
          "type": "string"
        }
      },
      "required": [
        "kind"
      ],
      "type": "object"
    },
    "status": {
      "enum": [
        "settled",
        "pending"
      ],
      "type": "string"
    }
  },
  "required": [
    "id",
    "source",
    "status",
    "mode",
    "airport",
    "scenario"
  ],
  "type": "object"
}
