{
  "airport": "KOAK",
  "expected": {
    "amendments": [
      {
        "box": "altitude",
        "proposedFeet": 27000,
        "reason": "filed FL350 is inside RVSM airspace (FL290 through FL410), which a /G flight may not enter; the highest legal altitude at or below it is FL270"
      }
    ]
  },
  "id": "ws-koak-amendment-practice-1a-swa984",
  "mode": "amendment",
  "scenario": {
    "aircraftType": "B737",
    "callsign": "SWA984",
    "dayOfWeek": "tuesday",
    "departureRunway": "30",
    "destination": "KLAX",
    "equipmentSuffix": "/G",
    "filedAltitude": 35000,
    "filedRoute": "CNDEL5 SUSEY EBAYE BURGL IRNMN2",
    "localTime": "1400",
    "runwayConfigId": "SFOW",
    "squawk": "4602"
  },
  "sidVersions": {
    "CNDEL": {
      "id": "CNDEL5",
      "spoken": "Candle Five"
    }
  },
  "source": {
    "kind": "worksheet",
    "note": "Amendment Practice 1A; the sheet states no departure runway, so this is 30, the runway configuration SFOW defaults group jets_and_dh8d to it (default_for_groups), pending validation; validated by the user 2026-09-16: B737/G at FL350: an RVSM-capable type filing a non-RVSM suffix has its altitude amended to FL270, the type stays as filed (user rule 2026-09-16)"
  },
  "status": "settled"
}
