{
  "airport": "KSFO",
  "expected": {
    "altitude": {
      "phrase": "climb_via"
    },
    "clearedTo": "KLAX",
    "expect": null,
    "frequency": "135.1",
    "route": {
      "fix": "SUSEY",
      "template": "transition"
    },
    "sidFamily": "SSTIK"
  },
  "id": "syn-sstik5-susey-01l",
  "mode": "clearance",
  "scenario": {
    "aircraftType": "A320",
    "callsign": "NKS642",
    "dayOfWeek": "friday",
    "departureRunway": "01L",
    "destination": "KLAX",
    "equipmentSuffix": "/L",
    "filedAltitude": 35000,
    "filedRoute": "SSTIK5 SUSEY EBAYE BURGL IRNMN2",
    "localTime": "1615",
    "runwayConfigId": "28/01",
    "squawk": "4406"
  },
  "sidVersions": {
    "SSTIK": {
      "id": "SSTIK5",
      "spoken": "Sstik Five"
    }
  },
  "source": {
    "kind": "synthetic",
    "note": "SFOW-S-SSTIK-01: southbound jets off 1L, which allows parallel departures with TRUKN# off 1R; expect clause dropped: the chart publishes expect filed altitude 10 minutes after departure (user rule 2026-09-15); SSTIK5 publishes FL190 and the plan files 35,000, above it, so the altitude is plain climb via SID (SOP 2-2 c (1) issues the interim table only when no top altitude is published, user decision 2026-09-15)"
  },
  "status": "settled"
}
