{
  "airport": "KSFO",
  "id": "ws-ksfo-amendment-practice-3-swa1254",
  "mode": "amendment",
  "scenario": {
    "aircraftType": "B737",
    "callsign": "SWA1254",
    "dayOfWeek": "tuesday",
    "departureRunway": "01R",
    "destination": "KBOI",
    "equipmentSuffix": "/L",
    "filedAltitude": 43000,
    "filedRoute": "SFO4 SAC ANAHO",
    "localTime": "1400",
    "runwayConfigId": "28/01",
    "squawk": "4610"
  },
  "sidVersions": {
    "SFO": {
      "id": "SFO5",
      "spoken": "San Francisco Five"
    }
  },
  "source": {
    "kind": "worksheet",
    "note": "Amendment Practice 3; the sheet states no departure runway, so this is 01R, the runway configuration 28/01 departs north per direction_runway_preference, pending validation"
  },
  "status": "pending"
}
