{
  "airport": "KSFO",
  "expected": {
    "amendments": [
      {
        "box": "altitude",
        "proposedFeet": 41000,
        "reason": "filed FL430 on a 61° magnetic course to Denver needs an odd level; the highest legal altitude at or below it is FL410"
      },
      {
        "box": "route",
        "proposed": "TRUKN2 SYRAH Q128 JSICA MLF J28 BDROC HAQHY SSKII1",
        "reason": "OAK6 is not the procedure the SOP assigns an RNAV jet from 01R in 28/01; it is TRUKN2"
      }
    ]
  },
  "id": "ws-ksfo-amendment-practice-1a-xoj715",
  "mode": "amendment",
  "scenario": {
    "aircraftType": "C750",
    "callsign": "XOJ715",
    "dayOfWeek": "tuesday",
    "departureRunway": "01R",
    "destination": "KDEN",
    "equipmentSuffix": "/L",
    "filedAltitude": 43000,
    "filedRoute": "OAK6 SYRAH Q128 JSICA MLF J28 BDROC HAQHY SSKII1",
    "localTime": "1400",
    "runwayConfigId": "28/01",
    "squawk": "4606"
  },
  "sidVersions": {
    "TRUKN": {
      "id": "TRUKN2",
      "spoken": "Trukn Two"
    }
  },
  "source": {
    "kind": "worksheet",
    "note": "Amendment Practice 1A; the sheet states no departure runway, so this is 01R, the runway configuration 28/01 departs north per direction_runway_preference, pending validation"
  },
  "status": "settled"
}
