{
  "airport": "KSFO",
  "expected": {
    "altitude": {
      "phrase": "climb_via"
    },
    "clearedTo": "KPDX",
    "expect": null,
    "frequency": "120.9",
    "route": {
      "fix": "GRTFL",
      "template": "transition"
    },
    "sidFamily": "TRUKN"
  },
  "id": "syn-stale-trukn1-grtfl-01r",
  "mode": "clearance",
  "scenario": {
    "aircraftType": "A320",
    "callsign": "UAL1877",
    "dayOfWeek": "tuesday",
    "departureRunway": "01R",
    "destination": "KPDX",
    "equipmentSuffix": "/L",
    "filedAltitude": 34000,
    "filedRoute": "TRUKN1 GRTFL MACHU TMBRS4",
    "localTime": "1500",
    "runwayConfigId": "28/01",
    "squawk": "4261"
  },
  "sidVersions": {
    "TRUKN": {
      "id": "TRUKN2",
      "spoken": "Trukn Two"
    }
  },
  "source": {
    "kind": "synthetic",
    "note": "A stale procedure version in the filed route: TRUKN1 is stripped like any other procedure token and the flight is cleared on the current TRUKN family; expect clause dropped: the chart publishes expect filed altitude 10 minutes after departure (user rule 2026-09-15); the current TRUKN2 publishes FL190 and the plan files 34,000, above it, so the altitude is plain climb via SID (SOP 2-2 c (1) issues the interim table only when no top altitude is published, user decision 2026-09-15)"
  },
  "status": "settled"
}
