{
  "airport": "KSFO",
  "expected": {
    "amendments": [
      {
        "box": "route",
        "proposed": "TRUKN2 TIPRE Q126 INSLO DTA RLG AKO MCK PWE RBA4",
        "reason": "NIITE3 is not the procedure the SOP assigns an RNAV jet from 01R in 28/01; it is TRUKN2"
      }
    ]
  },
  "id": "ws-ksfo-amendment-practice-1a-swa1859",
  "mode": "amendment",
  "scenario": {
    "aircraftType": "B737",
    "callsign": "SWA1859",
    "dayOfWeek": "tuesday",
    "departureRunway": "01R",
    "destination": "KMCI",
    "equipmentSuffix": "/L",
    "filedAltitude": 41000,
    "filedRoute": "NIITE3 TIPRE Q126 INSLO DTA RLG AKO MCK PWE RBA4",
    "localTime": "1400",
    "runwayConfigId": "28/01",
    "squawk": "4607"
  },
  "sidVersions": {
    "TRUKN": {
      "id": "TRUKN2",
      "spoken": "Trukn Two"
    }
  },
  "source": {
    "kind": "worksheet",
    "note": "Amendment Practice 1A; the sheet states no departure runway, so this is 01R, the runway configuration 28/01 departs north per direction_runway_preference, pending validation"
  },
  "status": "settled"
}
