{
  "airport": "KSFO",
  "id": "ws-ksfo-amendment-practice-2-nax7068",
  "mode": "amendment",
  "scenario": {
    "aircraftType": "B788",
    "callsign": "NAX7068",
    "dayOfWeek": "tuesday",
    "departureRunway": "28L",
    "destination": "ESSA",
    "equipmentSuffix": "/L",
    "filedAltitude": 39000,
    "filedRoute": "SFO4 DEDHD LKV J3 GEG J517 YXC ADVOX… (continued)",
    "localTime": "1400",
    "runwayConfigId": "28 RT",
    "squawk": "4611"
  },
  "sidVersions": {
    "SFO": {
      "id": "SFO5",
      "spoken": "San Francisco Five"
    }
  },
  "source": {
    "kind": "worksheet",
    "note": "Amendment Practice 2; the sheet states no departure runway, so this is 28L, the runway configuration 28 RT departs north per direction_runway_preference, pending validation"
  },
  "status": "pending"
}
