{
  "airport": "KOAK",
  "expected": {
    "amendments": [
      {
        "box": "altitude",
        "proposedFeet": 5000,
        "reason": "the TEC route to Rio Vista is flown at 5,000; a facility-directed altitude is not read against the direction-of-flight rule"
      },
      {
        "box": "route",
        "proposed": "NIMI6 OAK V6 SAC",
        "reason": "O88 is inside NorCal TRACON; the TEC route for a piston in SFOW is NIMI6 OAK V6 SAC"
      }
    ]
  },
  "id": "ws-koak-amendment-practice-3-n346g",
  "mode": "amendment",
  "scenario": {
    "aircraftType": "C172",
    "callsign": "N346G",
    "dayOfWeek": "tuesday",
    "departureRunway": "28R",
    "destination": "O88",
    "equipmentSuffix": "/A",
    "filedAltitude": 10000,
    "filedRoute": "CCR CCR2",
    "localTime": "1400",
    "runwayConfigId": "SFOW",
    "squawk": "4601"
  },
  "sidVersions": {
    "NIMI": {
      "id": "NIMI6",
      "spoken": "Nimitz Six"
    }
  },
  "source": {
    "kind": "worksheet",
    "note": "Amendment Practice 3; the sheet states no departure runway, so this is 28R, the runway configuration SFOW defaults class P to it (default_for_classes), pending validation; validated by the user 2026-09-16: TEC route to Rio Vista: NIMI6 OAK V6 SAC at 5,000"
  },
  "status": "settled"
}
