{
  "airport": "KSFO",
  "id": "ws-amendment-practice-3-voi5909",
  "mode": "amendment",
  "scenario": {
    "aircraftType": "A20N",
    "callsign": "VOI5909",
    "dayOfWeek": "tuesday",
    "departureRunway": "01L",
    "destination": "MMMX",
    "equipmentSuffix": "/L",
    "filedAltitude": 35000,
    "filedRoute": "KAYEX LOSHN BOILE J50 PDZ J93 PPE… (continued)",
    "localTime": "1400",
    "runwayConfigId": "28/01",
    "squawk": "4602"
  },
  "source": {
    "kind": "worksheet",
    "note": "Amendment Practice 3; the sheet states no departure runway, so this is 01L, the runway configuration 28/01 departs south per direction_runway_preference, pending validation; type A32N filed on the sheet, read as A20N"
  },
  "status": "pending"
}
