{
  "airport": "KSFO",
  "id": "ws-amendment-practice-3-n222t",
  "mode": "amendment",
  "scenario": {
    "aircraftType": "M20T",
    "callsign": "N222T",
    "dayOfWeek": "tuesday",
    "departureRunway": "28R",
    "destination": "KWVI",
    "equipmentSuffix": "/A",
    "filedAltitude": 7000,
    "filedRoute": "OAK V107 CATHE V111 SNS",
    "localTime": "1400",
    "runwayConfigId": "28/01",
    "squawk": "4613"
  },
  "source": {
    "kind": "worksheet",
    "note": "Amendment Practice 3; the sheet states no departure runway, so this is 28R, the runway configuration 28/01 defaults class P to it (default_for_classes), pending validation"
  },
  "status": "pending"
}
