{
  "airport": "KSFO",
  "expected": {
    "amendments": [
      {
        "box": "altitude",
        "proposedFeet": 32000,
        "reason": "filed FL330 on a 346° magnetic course to Seattle needs an even level under LOA-ZSE-PARITY; the highest legal altitude at or below it is FL320"
      }
    ]
  },
  "id": "ws-ksfo-amendment-practice-1a-swa126",
  "mode": "amendment",
  "scenario": {
    "aircraftType": "B737",
    "callsign": "SWA126",
    "dayOfWeek": "tuesday",
    "departureRunway": "01R",
    "destination": "KSEA",
    "equipmentSuffix": "/L",
    "filedAltitude": 33000,
    "filedRoute": "TRUKN2 DEDHD RBL LMT HAWKZ7",
    "localTime": "1400",
    "runwayConfigId": "28/01",
    "squawk": "4613"
  },
  "sidVersions": {
    "TRUKN": {
      "id": "TRUKN2",
      "spoken": "Trukn Two"
    }
  },
  "source": {
    "kind": "worksheet",
    "note": "Amendment Practice 1A; the sheet states no departure runway, so this is 01R, the runway configuration 28/01 departs north per direction_runway_preference, pending validation"
  },
  "status": "settled"
}
