{
  "airport": "KOAK",
  "expected": {
    "amendments": [
      {
        "box": "type",
        "proposed": "B752/L",
        "reason": "the route needs RNAV, which a /A flight does not have (Q124 is an RNAV route, KAMPR is an RNAV waypoint), and no conventional route can replace it, so the type box takes the suffix this aircraft normally files"
      },
      {
        "box": "altitude",
        "proposedFeet": 33000,
        "reason": "filed FL340 on a 62° magnetic course to Denver needs an odd level; the highest legal altitude at or below it is FL330"
      },
      {
        "box": "route",
        "proposed": "OAK6 OAK MOGEE Q124 BVL TCH KAMPR LONGZ1",
        "reason": "HUSSH2 is not the procedure the SOP assigns an RNAV jet from 30 in SFOW; it is OAK6"
      }
    ]
  },
  "id": "ws-koak-amendment-practice-2-fdx3859",
  "mode": "amendment",
  "scenario": {
    "aircraftType": "B752",
    "callsign": "FDX3859",
    "dayOfWeek": "tuesday",
    "departureRunway": "30",
    "destination": "KDEN",
    "equipmentSuffix": "/A",
    "filedAltitude": 34000,
    "filedRoute": "HUSSH2 MOGEE Q124 BVL TCH KAMPR LONGZ1",
    "localTime": "1400",
    "runwayConfigId": "SFOW",
    "squawk": "4602"
  },
  "sidVersions": {
    "HUSSH": {
      "id": "HUSSH2",
      "spoken": "Hush Two"
    },
    "OAK": {
      "id": "OAK6",
      "spoken": "Oakland Six"
    }
  },
  "source": {
    "kind": "worksheet",
    "note": "Amendment Practice 2; the sheet states no departure runway, so this is 30, the runway configuration SFOW defaults group jets_and_dh8d to it (default_for_groups), pending validation; validated by the user 2026-09-16: B752/A at FL340: altitude amended to FL270, type as filed (user rule 2026-09-16); HUSSH2 is RNAV and window-only, so OAK6; the proposed route will gain OAK after the vector SID when that concept lands; re-settled 2026-09-17: the route carries SFO/OAK after the vector SID (R-RV-NAVAID, warning tier); re-opened 2026-09-17: a /A aircraft cannot file Q124 / LOSHN (RNAV elements), the engine now answers with the type box; awaiting the user's confirmation; confirmed by the user 2026-09-17: type box to the fleet's RNAV suffix (RNAV elements), altitude and route judged on that plan"
  },
  "status": "settled"
}
