{
  "airport": "KSFO",
  "expected": {
    "altitude": {
      "phrase": "climb_via"
    },
    "clearedTo": "KSAN",
    "expect": null,
    "frequency": "135.1",
    "route": {
      "fix": "YYUNG",
      "template": "transition"
    },
    "sidFamily": "SSTIK"
  },
  "id": "syn-sstik5-yyung-01l-segul-off",
  "mode": "clearance",
  "scenario": {
    "aircraftType": "B737",
    "callsign": "SWA1188",
    "dayOfWeek": "monday",
    "departureRunway": "01L",
    "destination": "KSAN",
    "equipmentSuffix": "/L",
    "filedAltitude": 41000,
    "filedRoute": "SEGUL1 YYUNG LAX COMIX2",
    "localTime": "1020",
    "runwayConfigId": "28/01",
    "squawk": "3345"
  },
  "sidVersions": {
    "SEGUL": {
      "id": "SEGUL1",
      "spoken": "Segul One"
    },
    "SSTIK": {
      "id": "SSTIK5",
      "spoken": "Sstik Five"
    }
  },
  "source": {
    "kind": "synthetic",
    "note": "SFO-SEGUL-OFF is active by default, so the SFOW-S-SEGUL row drops out and SSTIK#.YYUNG is issued instead; expect clause dropped: the chart publishes expect filed altitude 10 minutes after departure (user rule 2026-09-15); SSTIK5 publishes FL190 and the plan files 41,000, above it, so the altitude is plain climb via SID (SOP 2-2 c (1) issues the interim table only when no top altitude is published, user decision 2026-09-15)"
  },
  "status": "settled"
}
