{
  "airport": "KSFO",
  "id": "ws-ksfo-amendment-practice-1c-n238jp",
  "mode": "amendment",
  "scenario": {
    "aircraftType": "C55B",
    "callsign": "N238JP",
    "dayOfWeek": "tuesday",
    "departureRunway": "28L",
    "destination": "KJAC",
    "equipmentSuffix": "/L",
    "filedAltitude": 32000,
    "filedRoute": "TRUKN2 ORRCA Q120 GALLI PARZZ TUVOC LEIDY DNW",
    "localTime": "1400",
    "runwayConfigId": "28 SO",
    "squawk": "4601"
  },
  "sidVersions": {
    "TRUKN": {
      "id": "TRUKN2",
      "spoken": "Trukn Two"
    }
  },
  "source": {
    "kind": "worksheet",
    "note": "Amendment Practice 1C; the sheet states no departure runway, so this is 28L, the runway configuration 28 SO departs north per direction_runway_preference, pending validation"
  },
  "status": "pending"
}
