{
  "airport": "KOAK",
  "expected": {
    "altitude": {
      "feet": 19000,
      "phrase": "climb_via_except"
    },
    "clearedTo": "KSLC",
    "expect": null,
    "frequency": "120.9",
    "route": {
      "fix": "MOGEE",
      "template": "radar_vectors_fix"
    },
    "sidFamily": "OAK"
  },
  "id": "ws-koak-phraseology-practice-1a-swa2125",
  "mode": "clearance",
  "scenario": {
    "aircraftType": "B738",
    "callsign": "SWA2125",
    "dayOfWeek": "tuesday",
    "departureRunway": "30",
    "destination": "KSLC",
    "equipmentSuffix": "/L",
    "filedAltitude": 39000,
    "filedRoute": "OAK6 MOGEE Q124 BVL WAATS5",
    "localTime": "1400",
    "runwayConfigId": "SFOW",
    "squawk": "3332"
  },
  "sidVersions": {
    "OAK": {
      "id": "OAK6",
      "spoken": "Oakland Six"
    }
  },
  "source": {
    "kind": "worksheet",
    "note": "Phraseology Practice 1A; the sheet states no departure runway, so this is 30, the runway configuration SFOW defaults group jets_and_dh8d to it (default_for_groups), pending validation; validated by the user 2026-09-16: Oakland Six departure, radar vectors Mogee, then as filed, climb via SID except maintain FL190, 120.9; the chart publishes the expect note"
  },
  "status": "settled"
}
