{
  "airport": "KSFO",
  "expected": {
    "altitude": {
      "phrase": "climb_via"
    },
    "clearedTo": "CYVR",
    "expect": null,
    "frequency": "120.9",
    "route": {
      "fix": "DEDHD",
      "template": "transition"
    },
    "sidFamily": "SNTNA"
  },
  "id": "syn-sntna2-dedhd-28l-2801",
  "mode": "clearance",
  "scenario": {
    "aircraftType": "A306",
    "callsign": "UPS2749",
    "dayOfWeek": "monday",
    "departureRunway": "28L",
    "destination": "CYVR",
    "equipmentSuffix": "/L",
    "filedAltitude": 36000,
    "filedRoute": "SNTNA2 DEDHD LMT BTG J1 SEA PAE GRIZZ1",
    "localTime": "0915",
    "runwayConfigId": "28/01",
    "squawk": "3104"
  },
  "sidVersions": {
    "SNTNA": {
      "id": "SNTNA2",
      "spoken": "Sntna Two"
    }
  },
  "source": {
    "kind": "synthetic",
    "note": "SFOW-N-SNTNA-28 in the 28/01 configuration, where SOP 2-1 e reserves the 28s for oceanic, Far East and cargo flights: a heavy freighter northbound off 28L; expect clause dropped: the chart publishes expect filed altitude 10 minutes after departure (user rule 2026-09-15); SNTNA2 publishes 3,000 and the plan files 36,000, above it, so the altitude is plain climb via SID (SOP 2-2 c (1) issues the interim table only when no top altitude is published, user decision 2026-09-15)"
  },
  "status": "settled"
}
